"Resistance penalty:",抗性惩罚:
"Act {0}{1}%)","第 {0} 章 {1}%)"
"Enemy Level:",敌人等级:
"This overrides the default enemy level used to estimate your hit and evade chances.",设置敌人等级会影响你的命中和闪避几率估算.
"The default level is your character level, capped at 84, which is the same value","默认等级和你的角色等级相同(最高84级),此设定与游戏相同"
"used in-game to calculate the stats on the character sheet.",在游戏中用于计算角色状态面板
"Enemy Physical Hit Damage:",敌人击中物理伤害:
"This overrides the default damage amount used to estimate your physical damage reduction from armour.",设置伤害量会影响你来自护甲的物理伤害减免估算
"The default is 1.5 times the enemy's base damage, which is the same value","默认值为敌人基础伤害的 1.5 倍,此设定与游戏相同"
"used in-game to calculate the estimate shown on the character sheet.",在游戏中用于估算角色面板.
"Enemy Corpse Life:",敌人灵柩^xE05030生命:
"Sets the maximum life of the target corpse for Detonate Dead and similar skills.","设置 【爆灵术】 等类似的技能的灵柩最大生命"
"For reference, a level 70 monster has 6937 base life, and a level 80 monster has 12787.","参考: 70 级怪物基础生命为 6937, 80 级怪物为 12787."
"Time spent stationary","静止时长"
"Applies mods that use `while stationary` and `per/every second while stationary`","启用'当你静止'、'静止时每秒'之类的修正"
"Are you always moving?","是否处于移动状态?"
"Are you always on Full Life?","是否处于满血状态?"
"You will automatically be considered to be on Full Life if you have Chaos Inoculation,","如果你有【异灵之体】将一直被视为满血状态,"
"but you can use this option to force it if necessary.","如有必要可用此选项强制应用."
"Are you always on Low Life?","是否处于低血状态?"
"You will automatically be considered to be on Low Life if you have at least 50% life reserved,","如果你至少有 50% 生命保留将一直被视为低血状态,"
"Are you always on Low Mana?","是否处于低魔状态?"
"You will automatically be considered to be on Low Mana if you have at least 50% life reserved,","如果你至少有 50% 魔力保留将一直被视为低魔状态,"
"Are you always on Full Energy Shield?","是否处于满盾状态?"
"Are you always on Low Energy Shield?","是否处于低盾状态?"
"You will automatically be considered to be on Low Energy Shield if you have at least 50% ES reserved,","如果你至少有 50% 能量护盾保留将一直被视为低盾状态,"
"Do you always have Energy Shield?","是否一直有能量护盾?"
"Are your minions always on Full Life?","你的召唤物是否处于满血状态?"
"Have your Minions been created Recently?","你的召唤物是否是近期内创造的?"
"Ailment calculation mode:","异常状态计算模式:"
"Average","平均"
"Crits Only","仅暴击"
"Minimum","最小值"
"Maximum","最大值"
"Controls how the base damage for applying Ailments is calculated:","控制如何计算异常状态的基础伤害:"
"\tAverage: damage is based on the average application, including both crits and non-crits","平均:伤害计算基于平均应用，包括了暴击与非暴击"
"\tCrits Only: damage is based solely on Ailments inflicted with crits","仅暴击:伤害计算只基于暴击产生的异常状态"
"Life regen calculation mode:","生命回复计算模式:"
"Controls how life regeneration is calculated:","控制如何计算生命回复:"
"Armour calculation mode:","护甲计算模式:"
"Controls how Defending with Double Armour is calculated:","控制如何计算使用双倍护甲防御:"
"This setting has no effect if you have 100% chance to Defend with Double Aromur.","此设置在你有100%几率使用双倍护甲进行防御时无效"
"EHP calculation mode:","有效生命值计算模式:"
"Controls which types of damage the EHP calculation uses:","控制有效生命值计算时使用何种伤害类型:"
"If a specific damage type is selected,that will be the pnly type used.","若选择了一个特定的伤害类型，那将会是唯一被用于计算的伤害类型"
"Warcry calculation mode:","战吼计算模式:"
"Max Hit","最大击中"
"Controls how exerted attacks from Warcries are calculated:","控制如何计算战吼后的增助攻击:"
"Average: Averages out Warcry usage with cast time, attack speed and warcry cooldown .","平均：用施法用时，攻击速度和战吼冷却时间来计算战吼的使用."
"Max Hit: Shows maximum hit for lining up all warcries.","最大击中:显示排列所有战吼的最大击中伤害。"
"Disable Emperor's Vigilance Bypass","禁用【皇帝的警戒】的规避效果"
"When In Combat",战斗状态
"Crit Damage",暴击伤害
"Aspect of the Avian:",【鸟之势】:
"Is Avian's Might active?",【鸟之力量】激活状态?
"Is Avian's Flight active?",【鸟之斗魄】激活状态?
"Aspect of the Cat:",【猫之势】:
"Is Cat's Stealth active?",【猫之隐匿】激活状态?
"Is Cat's Agility active?",【猫之敏捷】激活状态?
"Aspect of the Crab:",【蟹之势】:
"# of Crab Barriers (if not maximum):","# 层【深海屏障】 (如果不是最大值)"
"Aspect of the Spider:",【蛛之势】:
"# of Spider's Web Stacks:","# 层蜘蛛网"
"Banner Skills:",旗帜技能:
"Is Banner Planted?",旗帜已放置?
"Banner Stages:",旗帜阶层:
Bladestorm:,【剑刃风暴】:
"Are you in a Bloodstorm?",是否处于血姿态?
"Are you in a Sandstorm?",是否处于沙姿态?
"Brand Skills:",烙印技能:
"Is Attached to the Enemy?",烙印已附着的敌人?
"Dark Pact:",【暗夜血契】:
"Skeleton Life:",魔侍生命:
"Sets the maximum life of the skeleton that is being targeted.",设置目标魔侍的最大生命.
Deathmark:,【死亡印记】:
"Is the enemy Deathmarked?",【死亡印记】的敌人?
"Feeding Frenzy:",【狂噬】:
"Is Feeding Frenzy active?",【狂噬】激活状态?
"Feeding Frenzy grants:","【狂噬】 获得:"
"10% more Minion Damage","额外提高 10% 召唤物伤害"
"15% increased Minion Movement Speed","提高 15% 召唤物移动速度"
"15% increased Minion Attack and Cast Speed","提高 15% 召唤物攻击和施法速度"
"Herald of Agony:",【苦痛之捷】:
"# of Virulence Stacks:","# 【毒力】层数:"
"Ice Nova:",【冰霜新星】:
"Cast on Frostbolt?",施放【寒冰弹】?
Infusion:,【灌注】:
"Is Infusion active?",【灌注】激活状态?
Innervate:,【闪电支配】:
"Is Innervation active?",【闪电支配】激活状态?
Intensify:,【法术凝聚】:
"# of Intensity:","# 【法术凝聚】:"
"Meat Shield:",【肉盾】:
"Is the enemy near you?",附近的敌人?
"Raise Spectre:",【召唤灵体】:
"Spectre Level:",灵体等级:
"Sets the level of the raised spectre.",设置来提高灵体等级
"The default level is the level requirement of the Raise Spectre skill.",默认等级为【召唤灵体】需求等级:
"Enable curses:",启用诅咒:
"Enable any curse skills that your spectres have.",启用灵体拥有的诅咒技能.
"Blade Vortex blade count:",【飞刃风暴】刀片数:
"Sets the blade count for Blade Vortex skills used by spectres.",设置灵体拥有的【飞刃风暴】刀片数.
"Default is 1; maximum is 5.","默认为 1; 最大为 5."
"Scorching Ray Totem stage count:",【灼热光线】图腾阶数:
"Enable Summoned Ursa's Rallying Cry:",启用【召唤之爪】的激励战吼:
"Raise Spiders:",【召唤毒蛛】:
"# of Spiders:","# 蜘蛛:"
"Siphoning Trap:",【虹吸陷阱】:
"# of Enemies affected:","# 影响的敌人:"
"Sets the number of enemies affected by Siphoning Trap.",设置受【虹吸陷阱】影响的敌人数量.
"Stance Skills:",姿态技能:
Stance:,姿态:
"Summon Holy Relic:","召唤 【召唤生物】:"
"Enable Holy Relic's Boon Aura:",启用【召唤生物】光环:
"Summon Lightning Golem:","召唤 【闪电魔像】:"
"Enable Wrath Aura:",启用【雷霆】光环:
Vortex:,【漩涡】:
"Wave of Conviction:",【定罪波】:
"Exposure Type:",暴漏类型:
"Winter Orb:",【寒冬宝珠】:
Stages:,等阶:
"Withering Touch:",【凋零之触】:
"# of Withered Stacks:","# 【死亡凋零】层数:"
"Map Prefix Modifiers:",地图前缀加成:
"Enemy Physical Damage reduction:",怪物物理伤害减伤:
'Armoured','装甲的'
"Enemy is Hexproof?",敌人是【无咒的】?
'Hexproof','无咒的'
"Less effect of Curses on Enemy:",对怪物的诅咒总效果额外降低:
'Hexwarded','魔抗的'
"Enemy avoid Poison/Blind/Bleed:",怪物几率免疫中毒，致盲和流血:
'Impervious','避毒的'
"Enemy has Elemental/Chaos Resist:",增加怪物的火焰、冰霜、闪电、混沌抗性:
'Resistant','抗性的'
"Map Suffix Modifiers:",地图后缀加成:
"Player has Elemental Equilibrium?",玩家有【元素之相】?
"'of Balance'",'平衡之'
"Cannot Leech Life/Mana?",无法偷取怪物生命和魔力?
"'of Congealment'",'凝血之'
"Gains reduced Flask Charges:",玩家获得的药剂充能降低:
"'of Drought'",'干枯之'
"-X% maximum Resistances:","-X% 玩家的抗性上限:"
"'of Exposure'",'曝露之'
"Mid tier: 5-8%","中阶: 5-8%"
"High tier: 9-12%","高阶: 9-12%"
"Less Area of Effect:",玩家技能的总范围额外缩小:
"'of Impotence'",'短程之'
"Enemy avoid Elem. Status Ailments:",怪物免疫元素异常状态:
"'of Insulation'",'隔绝之'
"Unlucky Dodge/Enemy has inc. Accuracy:",玩家在躲避时很不幸/怪物命中值提高:
"'of Miring'",'迟钝之'
"Reduced Block Chance/less Armour:",玩家的格挡率和护甲额外降低:
"'of Rust'",'生锈之'
"Player has Point Blank?",玩家拥有【零点射击】?
"'of Skirmishing'",'冲突之'
"Less Recovery of Life and Energy Shield:",玩家的生命和能量护盾总回复速度额外降低:
"'of Smothering'",'窒息之'
"Cannot Regen Life, Mana or ES?",玩家无法回复生命，魔力和能量护盾?
"'of Stasis'",'瘀血之'
"Enemy takes red. Extra Crit Damage:",怪物受到的暴击伤害降低:
"'of Toughness'",'坚韧之'
"Low tier: 25-30%","低阶: 25-30%"
"Mid tier: 31-35%","中阶: 31-35%"
"High tier: 36-40%","高阶: 36-40%"
"# of Sextants affecting the area","# 个六分仪影响该地区"
"Player is cursed by:",玩家被诅咒:
"Assassin's Mark:",【暗影印记】:
"Sets the level of Assassin's Mark to apply to the player.",设置玩家应用的【暗影印记】等级.
Conductivity:,【导电】:
"Sets the level of Conductivity to apply to the player.",设置玩家应用的【导电】等级.
Despair:,【绝望】:
"Sets the level of Despair to apply to the player.",设置玩家应用的【绝望】等级.
"Elemental Weakness:",【元素要害】:
"Sets the level of Elemental Weakness to apply to the player.",设置玩家应用的【元素要害】等级.
"In mid tier maps, 'of Elemental Weakness' applies level 10.","在中阶地图,【元素要害】的等级是 10."
"In high tier maps, 'of Elemental Weakness' applies level 15.","在高阶地图,【元素要害】的等级是 15."
Enfeeble:,【衰弱】:
"Sets the level of Enfeeble to apply to the player.",设置玩家应用的【衰弱】等级.
"In mid tier maps, 'of Enfeeblement' applies level 10.","在中阶地图,【衰弱】的等级是 10."
"In high tier maps, 'of Enfeeblement' applies level 15.","在高阶地图,【衰弱】的等级是 15."
Flammability:,【易燃】
"Sets the level of Flammability to apply to the player.",设置玩家应用的【易燃】等级.
Frostbite:,【冻伤】:
"Sets the level of Frostbite to apply to the player.",设置玩家应用的【冻伤】等级.
"Poacher's Mark:",【盗猎者印记】:
"Sets the level of Poacher's Mark to apply to the player.",设置玩家应用的【盗猎者印记】等级.
"Projectile Weakness:",【投射物要害】:
"Sets the level of Projectile Weakness to apply to the player.",设置玩家应用的【投射物要害】等级.
Punishment:,【惩戒】:
"Sets the level of Punishment to apply to the player.",设置玩家应用的【惩戒】等级.
"Temporal Chains:",【时空锁链】:
"Sets the level of Temporal Chains to apply to the player.",设置玩家应用的【时空锁链】等级.
"In mid tier maps, 'of Temporal Chains' applies level 10.","在中阶地图,【时空锁链】的等级是 10."
"In high tier maps, 'of Temporal Chains' applies level 15.","在高阶地图,【时空锁链】的等级是 15."
Vulnerability:,【脆弱】:
"Sets the level of Vulnerability to apply to the player.",设置玩家应用的【脆弱】等级.
"In mid tier maps, 'of Vulnerability' applies level 10.","在中阶地图,【脆弱】的等级是 10."
"In high tier maps, 'of Vulnerability' applies level 15.","在高阶地图,【脆弱】的等级是 15."
"Warlord's Mark:",【督军印记】:
"Sets the level of Warlord's Mark to apply to the player.","设置玩家应用的【督军印记】等级."
"Do you use Power Charges?","是否有暴击球?"
"# of Power Charges (if not maximum):","# 暴击球数量 (如果不是最大值):"
"Do you use Frenzy Charges?","是否有狂怒球?"
"# of Frenzy Charges (if not maximum):","# 狂怒球数量 (如果不是最大值):"
"Do you use Endurance Charges?","是否有耐力球?"
"# of Endurance Charges (if not maximum):","# 耐力球数量 (如果不是最大值):"
"Do you use Siphoning Charges?","是否有轮回球?"
"# of Siphoning Charges (if not maximum):","# 轮回球数量 (如果不是最大值):"
"Do you use Challenger Charges?","是否有挑战球?"
"# of Challenger Charges (if not maximum):","# 挑战球数量 (如果不是最大值):"
"Do you use Blitz Charges?","是否有疾电球?"
"# of Blitz Charges (if not maximum):","# 疾电球数量 (如果不是最大值):"
"# of Gale Force:","# 【飓风之力】个数"
"Base maximum Gale Force is 10.","【飓风之力】个数基础上限为10."
"Do you use Inspiration Charges?","是否有启迪球?"
"# of Inspiration Charges (if not maximum):","# 启迪球数量 (如果不是最大值):"
"Do you use Ghost Shrouds?","是否有【鬼影缠身】?"
"# of Ghost Shrouds (if not maximum):","# 【鬼影缠身】层数 (如果不是最大值):"
"Do you wait for Maximum Unleash Seals?","是否在等待获得最大封印层数?"
"# of Blood Charges (if not maximum):","# 赤炼球数量 (如果不是最大值):"
"Do your minions use Power Charges?","召唤物是否有暴击球?"
"Do your minions use Frenzy Charges?","召唤物是否有狂怒球?"
"Do your minions use Endur. Charges?","召唤物是否有耐力球?"
"# of Rampage Kills:","# 【暴走】层数:"
"Rampage grants the following, up to 1000 stacks:","# 暴走层数会带来以下效果，最大层数为1000层:"
"You lose Rampage if you do not get a Kill within 5 seconds.","你会在持续5秒无击杀后失去暴走状态."
"Are you Focused?","是否有【专注】?"
"Do you have Lifetap?","是否有【赤炼】?"
"Do you have Onslaught?","是否有【猛攻】?"
"In addition to allowing any 'while you have Onslaught' modifiers to apply,","开启时 '当你处于【猛攻】' 之类的修正生效,"
"this will enable the Onslaught buff itself. (Grants 20% increased Attack, Cast, and Movement Speed)","这将开启【猛攻】增益效果. (攻击/施法/移动速度提高 20% )"
"Do your minions have Onslaught?","召唤物是否有【猛攻】?"
"In addition to allowing any 'while your minions have Onslaught' modifiers to apply,","开启时 '当你的召唤物处于【猛攻】' 之类的修正生效,"
"Do you have Unholy Might?","是否有【不洁之力】?"
"This will enable the Unholy Might buff. (Grants 30% of Physical Damage as Extra Chaos Damage)","这将开启【不洁之力】增益效果. (获得等于30%物理伤害的额外混沌伤害)"
"Do your minions have Unholy Might?","召唤物是否有【不洁之力】?"
"This will enable the Unholy Might buff on your minions. (Grants 30% of Physical Damage as Extra Chaos Damage)","这将为你的召唤物开启【不洁之力】增益效果. (获得等于30%物理伤害的额外混沌伤害)"
"Do you have Phasing?","是否有【迷踪】?"
"Are you Fortified?","是否有【护体】?"
"# of Fortification Stacks (if not maximum):","#【护体】层数（若非最大值）"
"You have 1% less damage taken from hits per stack of fortification:","每层护体使你受到的击中伤害降低1%"
"Has a default cap of 20 stacks.","默认层数上限为20"
"Do you have Tailwind?","是否有【提速尾流】?"
"In addition to allowing any 'while you have Tailwind' modifiers to apply,","开启时 '当你处于【提速尾流】' 之类的修正生效,"
"this will enable the Tailwind buff itself. (Grants 8% increased Action Speed)","这将开启【提速尾流】增益效果. (赋予8%行动速度提升)"
"Do you have Adrenaline?","是否有【肾上腺素】?"
"This will enable the Adrenaline buff, which grants:","这将开启【肾上腺素】增益效果:"
"100% increased Damage","伤害提高 100%"
"25% increased Attack, Cast and Movement Speed","攻击/施法/移动速度提高 25%"
"10% additional Physical Damage Reduction","额外 10% 物理伤害减免"
"Do you have Alchemist's Genius?","是否有【炼金奇才】?"
"This will enable the Alchemist's Genius buff:","这将开启【炼金奇才】增益效果:"
"10% increased effect of Flasks","药剂效果提升10%"
"Do you have Vaal Arc's Lucky Buff?","是否有瓦尔电弧的【幸运】增益?"
"Causes Damage with Arc Hits to be rolled twice, and the maximum roll used.","以电弧击中造成的伤害会roll两次，取最大值实行."
"Are you Elusive?","是否有【灵巧】?"
"In addition to allowing any 'while Elusive' modifiers to apply,","开启时 '当你处于【灵巧】' 之类的修正生效,"
"this will enable the Elusive buff itself:","这将开启【灵巧】增益效果:"
"The effect of Elusive decays over time.","【灵巧】增益效果会随时间衰减"
"Effect of Elusive (if not maximum):","【灵巧】效果强度(如果不是最大值):"
"If you have a guaranteed source of Elusive, the strongest one will apply. ","如果你有一个可靠的【灵巧】来源，将会应用最大效果强度."
"You can change this see decaying buff values","你可以改变此值以观察衰减后的增益效果"
"Do you have Divinity?","是否有【神性】?"
"This will enable the Divinity buff:","这将开启【神性】增益效果:"
"50% more Elemental Damage","额外 50% 元素伤害"
"20% less Elemental Damage Taken","承受的元素伤害额外降低 20%"
"Rage:","【怒火】:"
"Are you Leeching?","是否在偷取?"
"Are you Leeching Life?","是否在偷取生命?"
"Are you Leeching Energy Shield?","是否在偷取能量护盾?"
"Are you Leeching Mana?","是否在偷取魔力?"
"Do you have a Flask active?","是否有药剂激活?"
"This is automatically enabled if you have a flask active,","如果有使用药剂将会自动开启此状态,"
"Do you have a Totem summoned?","是否有召唤图腾?"
"You will automatically be considered to have a Totem if your main skill is a Totem,","如果你的主技能是图腾技能将自动被视为有召唤图腾,"
"Have you Summoned a Totem Recently?","是否近期内有召唤图腾?"
"You will automatically be considered to have Summoned a Totem Recently if your main skill is a Totem,","如果你的主技能是图腾技能将自动被视为近期内有召唤图腾,"
"# of Summoned Totems (if not maximum):","召唤的图腾数量(如果不是最大值):"
"# of Nearby Allies","# 附近的友军数"
"# of Nearby Enemies","# 附近的敌人数"
"# of Nearby Corpses","# 附近的灵枢数"
"Are you on Consecrated Ground?","是否在【奉献地面】上?"
"In addition to allowing any 'while on Consecrated Ground' modifiers to apply,","开启时 '你在【奉献地面】上' 之类的修正生效,"
"this will apply the 6% life regen modifier granted by Consecrated Ground.","这将应用【奉献地面】的 获得 6% 生命回复加成."
"Are you on Fungal Ground?",是否在【真菌地表】上?
"Allies on your Fungal Ground gain 10% of Non-Chaos Damage as extra Chaos Damage.",【真菌地表】上的盟友获得额外10%非混沌伤害的混沌伤害
"Are you on Burning Ground?",是否在^xB97123【燃烧地面】^7上?
"This also implies that you are Burning.",这也意味着你在燃烧.
"Are you on Chilled Ground?",是否在【冰缓地面】上?
"This also implies that you are Chilled.",这也意味着你被冰缓.
"Are you on Shocked Ground?",是否在【感电地面】上?
"This also implies that you are Shocked.",这也意味着你被感电.
"Are you Blinded?",你被致盲?
"Are you Burning?",你被燃烧?
"Are you Ignited?",你被点燃?
"Are you Chilled?",你被冰缓?
"Are you Frozen?",你被冰冻?
"Are you Shocked?",你被感电?
"Are you Bleeding?",你被流血?
"Are you Poisoned?",你被中毒?
"# of Poison on You:","# 你的中毒层数:"
"This also implies that you are Poisoned.",这也意味着你中毒了.
"Is there only one nearby Enemy?",附近只有一个敌人?
"Have you Hit Recently?",你近期有击中?
"You will automatically be considered to have Hit Recently if your main skill is self-cast,","如果你的主技能是自施放将自动开启此状态,"
"Have you Crit Recently?",你近期有暴击?
"This also implies that your Skills have Crit Recently.",这也意味着你近期有暴击.
"Have your Skills Crit Recently?",你的技能近期有暴击?
"Have you dealt a Non-Crit Recently?",你近期有非暴击?
"Have you Killed Recently?",你近期有击杀?
"# of Enemies Killed Recently","# 近期击杀敌人数"
"This also implies that you have Killed Recently.",这也意味着你近期有击杀.
"Have your Totems Killed Recently?",你的图腾近期有击杀?
"# of Enemies Killed by Totems Recently","# 图腾近期击杀敌人数"
"This also implies that your Totems have Killed Recently.",这也意味着你的图腾近期有击杀.
"Have your Minions Killed Recently?",你的召唤物近期有击杀?
"# of Enemies Killed by Minions Recently","# 召唤物近期击杀数"
"This also implies that your Minions have Killed Recently.",这也意味着你的召唤物近期有击杀.
"Killed Enemy affected by your DoT Recently?",你的持续伤害效果近期有击杀敌人?
"# of Shocked Enemies Killed Recently:","# 近期击杀感电的敌人数:"
"Have you Frozen an Enemy Recently?",你近期有冰冻敌人?
"Have you Shattered an Enemy Recently?",你近期有粉碎敌人?
"Have you Ignited an Enemy Recently?",你近期有点燃敌人?
"Have you Shocked an Enemy Recently?",你近期有感电敌人?
"# of Poisons applied Recently:","# 近期中毒数:"
"Have you been Hit Recently?",你近期被击中?
"Have you been Crit Recently?",你近期被暴击?
"Have you been Savage Hit Recently?",你近期被【残暴打击】?
"This also implies that you have been Hit Recently.",这也意味着你近期被击中.
"Have you been hit by Fire Recently?",你近期被火焰击中?
"Have you been hit by Cold Recently?",你近期被冰霜击中?
"Have you been hit by Light. Recently?",你近期被闪电击中?
"Have you Blocked Recently?",你近期有格挡?
"Have you Blocked an Attack Recently?",你近期有格挡攻击?
"This also implies that you have Blocked Recently.",这将意味着你近期有格挡.
"Have you Blocked a Spell Recently?",你近期有格挡法术?
"Energy Shield Recharge started Recently?",近期有启动能量护盾充能?
"Is Pendulum of Destruction active?",【毁灭光炮塔】激活状态?
"Conflux Buff:",汇流增益效果:
"Is Bastion of Hope active?",【希望壁垒】激活状态?
"Are you in Her Embrace?",你有【她的拥抱】?
"This option is specific to Oni-Goroshi.",这是【鬼弑·查兰之剑】的选项.
"Have you used a Skill Recently?",你近期有使用技能?
"# of Skills Used Recently:","# 近期使用技能数:"
"Have you Attacked Recently?",你近期有攻击?
"This also implies that you have used a Skill Recently.",这将意味着你近期有使用技能.
"You will automatically be considered to have Attacked Recently if your main skill is an attack,","如果你的主技能是攻击技能将会自动开启此状态,"
"Have you Cast a Spell Recently?",你近期有施放法术?
"You will automatically be considered to have Cast a Spell Recently if your main skill is a spell,","如果你的主技能是法术技能将会自动开启此状态,"
"Have you used a Fire Skill Recently?",你近期有使用火焰技能?
"Have you used a Cold Skill Recently?",你近期有使用冰霜技能?
"Have you used a Minion Skill Recently?",你近期有使用召唤物技能?
"You will automatically be considered to have used a Minion skill Recently if your main skill is a minion skill,","如果你的主技能是召唤生物技能将会自动开启此状态,"
"Have you used a Movement Skill Recently?",你近期有使用移动技能?
"You will automatically be considered to have used a Movement skill Recently if your main skill is a movement skill,","如果你的主技能是移动技能将会自动开启此状态,"
"Have you used a Vaal Skill Recently?",你近期有使用瓦尔技能?
"You will automatically be considered to have used a Vaal skill Recently if your main skill is a Vaal skill,","如果你的主技能是瓦尔技能将会自动开启此状态,"
"Do you have Soul Gain Prevention?",是否有【阻灵术】?
"Have you used a Warcry Recently?",你近期有使用战吼?
"# of Mines Detonated Recently:","# 近期引爆地雷数:"
"# of Traps Triggered Recently:","# 近期触发地雷数:"
"Consumed a corpse Recently?",近期有消耗灵柩?
"# of Corpses Consumed Recently:","# 近期消耗灵柩数:"
"Taunted an Enemy Recently?",近期有嘲讽敌人?
"Have you used a Fire Skill in the past 10s?","你过去 10 秒内有使用火焰技能?"
"Have you used a Cold Skill in the past 10s?","你过去 10 秒内有使用冰霜技能?"
